"Input","Output","Updated Feedback"
"I reduce use of innecesary power at home, in other words, I turn on light that I need for the while i use it;I take less warm shower; I hit only neccesary rooms.","I reduce the use of unnecessary power at home. In other words, I turn on a light that I need while I use it; I take cooler showers; I heat only the necessary rooms.","Efficient habits! The error is phrasing, punctuation, and spelling. Add ""the"" before ""use"" for article. Change ""innecesary"" to ""unnecessary"" for spelling. Add a period after ""home"" for sentence break. Change ""light that I need for the while i use it"" to ""a light that I need while I use it"" for article and tense. Change ""warm shower"" to ""cooler showers"" for plural and context. Change ""hit"" to ""heat"" for meaning. Change ""neccesary"" to ""necessary"" for spelling. This helps you use phrasing, punctuation, and spelling correctly. What’s the best way to reduce power use at home?"
"In order to reuse, I convert all thing reusable, for example, plastic bottle as a plant pot; glass bottle as a food container;I bring my reusable shopping bag and refuse to use a shopping plastic if a salemen offer me to bring.","In order to reuse, I convert all things reusable, for example, a plastic bottle into a plant pot; a glass bottle into a food container. I bring my reusable shopping bag and refuse to use a plastic shopping bag if a salesman offers me one.","Creative reuse! The error is phrasing, punctuation, and spelling. Change ""thing"" to ""things"" for plural. Change ""plastic bottle as a plant pot"" to ""a plastic bottle into a plant pot"" for preposition. Add a period after ""container"" for sentence break. Change ""shopping plastic"" to ""plastic shopping bag"" for clarity. Change ""salemen"" to ""salesman"" for spelling. Change ""offer me to bring"" to ""offers me one"" for agreement and phrasing. This helps you use phrasing, punctuation, and spelling accurately. What’s the best thing to reuse at home?"
"Recycling is another way to be ecologist.","Recycling is another way to be ecological.","Good practice! The error is phrasing. Change ""ecologist"" to ""ecological"" for adjective form. This helps you use phrasing effectively. What’s the best thing to recycle?"
"Today, we have more item to recycle as long as we clean properly and put in a proper bin, which will be use it by specialized factory in another item.","Today, we have more items to recycle as long as we clean them properly and put them in a proper bin, which will be used by specialized factories to make them into other items.","Important process! The error is phrasing, punctuation, and verb tense. Change ""item"" to ""items"" for plural. Add ""them"" after ""clean"" and ""put"" for object clarity. Change ""will be use it"" to ""will be used"" for passive voice. Change ""factory"" to ""factories"" for plural. Change ""in another item"" to ""to make them into other items"" for clarity. This helps you use phrasing, punctuation, and verb tenses correctly. What’s the best way to recycle items?"
"As long as i try to keep doing thing on a ecofriendly way i realize that i am give a little from my side and i feel careful of my environment.","As long as I try to keep doing things in an eco-friendly way, I realize that I am giving a little from my side, and I feel caring for my environment.","Positive attitude! The error is phrasing, punctuation, and verb tense. Capitalize ""I"" for consistency. Change ""thing"" to ""things"" for plural. Change ""on a ecofriendly way"" to ""in an eco-friendly way"" for preposition and hyphenation. Add a comma after ""side"" for clause. Change ""am give"" to ""am giving"" for tense. Add a comma before ""and"" for clause. Change ""feel careful of"" to ""feel caring for"" for natural phrasing. This helps you use phrasing, punctuation, and verb tenses accurately. What’s the best thing about being eco-friendly?"
"Hello!!How are you!!","Hello! How are you?","Friendly greeting! The error is punctuation. Remove extra exclamation marks for proper punctuation. This helps you use punctuation correctly. What’s the best way to greet someone?"
"I am going to Spain to visit my grandparents.Then I am going to Paris to look forward my aunt.","I am going to Spain to visit my grandparents. Then I am going to Paris to visit my aunt.","Exciting plans! The error is phrasing and punctuation. Add a period after ""grandparents"" for sentence break. Change ""look forward my aunt"" to ""visit my aunt"" for correct phrasing. This helps you use phrasing and punctuation accurately. What’s the best thing about visiting family?"
"Next I am going to Italy to see the PAPA.If you want I am going to Barcelona to go with you.","Next, I am going to Italy to see the Pope. If you want, I am going to Barcelona to go with you.","Great travel plans! The error is phrasing, punctuation, and capitalization. Add a comma after ""Next"" for clause. Change ""PAPA"" to ""Pope"" for clarity. Add a comma after ""want"" for clause. This helps you use phrasing, punctuation, and capitalization correctly. What’s the best thing about traveling with friends?"
"See you soon!!","See you soon!","Warm closing! The error is punctuation. Remove extra exclamation mark for proper punctuation. This helps you use punctuation accurately. What’s the best way to say goodbye?"
"PD: we have to meet","PS: we have to meet","Clear reminder! The error is phrasing. Change ""PD"" to ""PS"" for correct postscript abbreviation. This helps you use phrasing effectively. What’s the best way to end a letter?"
"Hï Jo,","Hi Jo,","Friendly greeting! The error is spelling. Change ""Hï"" to ""Hi"" for spelling. This helps you use spelling correctly. What’s the best way to start a letter to a friend?"
"In my opinion, it is a good idea about you spend some time travelling because you will have an opportunity to think about your future but in my city because of the crisis there is very little work for everyone.","In my opinion, it is a good idea to spend some time travelling because you will have an opportunity to think about your future, but in my city, because of the crisis, there is very little work for anyone.","Good advice! The error is phrasing, punctuation, and verb tense. Change ""about you spend"" to ""to spend"" for infinitive form. Add a comma after ""future"" for clause. Change ""for everyone"" to ""for anyone"" for consistency. This helps you use phrasing, punctuation, and verb tenses accurately. What’s the best thing about traveling?"
"Here, there are monuments, churches or famous people and perhaps to you in the future you would like to become a history teacher.","Here, there are monuments, churches, or famous people, and perhaps in the future you would like to become a history teacher.","Encouraging suggestion! The error is phrasing and punctuation. Add a comma after ""Here"" for sentence start. Add a comma before ""and"" for list structure. Remove ""to you"" and adjust phrasing for clarity. This helps you use phrasing and punctuation correctly. What’s the best thing about becoming a history teacher?"
"Although now that the holidays are coming you need people to help and ride the amusement park or the lights of the fair.","Although now that the holidays are coming, they need people to help work the amusement park or the lights of the fair.","Helpful opportunity! The error is phrasing, punctuation, and verb tense. Add a comma after ""coming"" for clause. Change ""you need"" to ""they need"" for subject consistency. Change ""and ride"" to ""to help work"" for clarity. This helps you use phrasing, punctuation, and verb tenses accurately. What’s the best thing about working at a fair?"
"If you come to Linares could amuse you and if you come forward to work can do it","If you come to Linares, you could amuse yourself, and if you come forward to work, you can do it.","Inviting offer! The error is phrasing, punctuation, and verb tense. Add a comma after ""Linares"" for clause. Add ""you"" after ""could amuse"" for subject. Add a comma after ""work"" for clause. Add ""you"" after ""can do"" for subject. This helps you use phrasing, punctuation, and verb tenses correctly. What’s the best thing about visiting Linares?"
"You have to come here because Holy Week in Linares is nice and the show is spectacular and if you want to have fun and I like the bulls","You have to come here because Holy Week in Linares is nice and the show is spectacular, and if you want to have fun, I like the bulls.","Exciting invitation! The error is phrasing and punctuation. Add a comma before ""and"" for clause. Add a comma after ""fun"" for clause. Adjust phrasing for clarity. This helps you use phrasing and punctuation accurately. What’s the best thing about Holy Week in Linares?"
"I hope to see you soon","I hope to see you soon.","Warm closing! The error is punctuation. Add a period at the end for punctuation. This helps you use punctuation correctly. What’s the best way to end a letter?"
"Sonia","Sonia","Simple signature! This sentence is grammatically correct. It uses proper phrasing and punctuation for a signature. What’s the best way to sign off a letter?"
"Hi Sara,","Hi Sara,","Friendly greeting! This sentence is grammatically correct. It uses proper phrasing and punctuation for a greeting. What’s the best way to start a letter to a friend?"
"It was great to hear from you.","It was great to hear from you.","Warm greeting! This sentence is grammatically correct. It uses proper phrasing and tense to describe a feeling. What’s the best thing about hearing from a friend?"
"It 's a very difficult decision for me too.","It's a very difficult decision for me too.","Relatable feeling! The error is punctuation. Remove extra space before period. This helps you use punctuation accurately. What’s the best way to make a difficult decision?"
"But if you want to decide, I 'll intend to help you.","But if you want to decide, I'll try to help you.","Supportive offer! The error is phrasing and verb tense. Change ""intend"" to ""try"" for natural phrasing. Add a comma after ""decide"" for clause. This helps you use phrasing and verb tenses correctly. What’s the best way to help someone decide?"
"On the one hand, you need a sport to keep fit.","On the one hand, you need a sport to keep fit.","Good point! This sentence is grammatically correct. It uses proper phrasing and tense to describe a need. What’s the best sport to keep fit?"
"On the other hand, music is the best for relaxing and enjoy.","On the other hand, music is the best for relaxing and enjoying yourself.","Balanced view! The error is phrasing and verb tense. Change ""enjoy"" to ""enjoying yourself"" for gerund and reflexive pronoun. This helps you use phrasing and verb tenses accurately. What’s the best thing about music for relaxation?"
"Well, I think you should n't give up either.","Well, I think you shouldn't give up either.","Encouraging advice! The error is phrasing and contraction. Change ""should n't"" to ""shouldn’t"" for contraction. This helps you use phrasing and contractions correctly. What’s the best way to balance sports and music?"
"You can devote more time to do both.","You can devote more time to doing both.","Practical suggestion! The error is phrasing and verb tense. Change ""to do"" to ""to doing"" for gerund form. This helps you use phrasing and verb tenses accurately. What’s the best way to manage time for both activities?"
"If I were you, I would go running at the morning and I would go to music classes after lunch.","If I were you, I would go running in the morning, and I would go to music classes after lunch.","Helpful plan! The error is phrasing and punctuation. Change ""at the morning"" to ""in the morning"" for preposition. Add a comma before ""and"" for clause. This helps you use phrasing and punctuation correctly. What’s the best time to go running?"
"So, you can do both.","So, you can do both.","Encouraging conclusion! This sentence is grammatically correct. It uses proper phrasing and tense to describe an action. What’s the best thing about doing both activities?"
"I hope this help you and you will take the best decision.","I hope this helps you, and you will make the best decision.","Supportive closing! The error is phrasing, punctuation, and verb tense. Change ""help"" to ""helps"" for subject-verb agreement. Add a comma before ""and"" for clause. Change ""take"" to ""make"" for idiomatic expression. This helps you use phrasing, punctuation, and verb tenses accurately. What’s the best way to make a decision?"
"Lots of love","Lots of love","Warm closing! This sentence is grammatically correct. It uses proper phrasing and punctuation for a closing. What’s the best way to end a letter to a friend?"
"Fira","Fira","Simple signature! This sentence is grammatically correct. It uses proper phrasing and punctuation for a signature. What’s the best way to sign off a letter?"
"I agree this affirmation because the public transport is more expensive than car, is slow and is less economic.","I agree with this affirmation because public transport is more expensive than a car, is slow, and is less economical.","Clear opinion! The error is phrasing, punctuation, and article. Add ""with"" after ""agree"" for preposition. Remove ""the"" before ""public transport"" for consistency. Add ""a"" before ""car"" for article. Add commas for list structure. Change ""economic"" to ""economical"" for adjective form. This helps you use phrasing, punctuation, and articles accurately. What’s the best thing about public transport despite its cost?"
"the car is less expensive, more confortable, more fast and more security.","A car is less expensive, more comfortable, faster, and safer.","Good comparison! The error is phrasing, punctuation, and adjective. Add ""A"" before ""car"" for article. Change ""confortable"" to ""comfortable"" for spelling. Change ""more fast"" to ""faster"" for comparative form. Change ""more security"" to ""safer"" for comparative form. This helps you use phrasing, punctuation, and adjectives correctly. What’s the best thing about having a car?"
"every time the car is more utilized and more economic.","Every time, a car is more utilized and more economical.","Interesting trend! The error is phrasing, punctuation, and adjective. Capitalize ""Every"" for sentence start. Add ""a"" before ""car"" for article. Change ""economic"" to ""economical"" for adjective form. This helps you use phrasing, punctuation, and adjectives accurately. What’s the best way to make cars more economical?"
"in my opinion the car more advantageous than car and the car is more useful","In my opinion, a car is more advantageous than a car, and a car is more useful.","Clear preference! The error is phrasing, punctuation, and article. Capitalize ""In"" for sentence start. Add a comma after ""opinion"" for clause. Add ""a"" before ""car"" for article consistency. Add ""and"" with a comma for clause separation. This helps you use phrasing, punctuation, and articles correctly. What’s the most useful thing about a car?"
"To my mind this mind not right.","To my mind, this is not right.","Honest opinion! The error is phrasing and punctuation. Add a comma after ""mind"" for clause. Change ""this mind not right"" to ""this is not right"" for structure. This helps you use phrasing and punctuation accurately. What’s the best way to express disagreement?"
"First of all travelling by car is very expensive.","First of all, travelling by car is very expensive.","Clear point! The error is phrasing and punctuation. Add a comma after ""all"" for clause. This helps you use phrasing and punctuation correctly. What’s the best way to save money on travel?"
"For example travelling by train is cheaper and travelling by plain is faser.","For example, travelling by train is cheaper, and travelling by plane is faster.","Good comparison! The error is phrasing, punctuation, and spelling. Add a comma after ""example"" for clause. Change ""plain"" to ""plane"" for spelling. Change ""faser"" to ""faster"" for spelling. Add a comma before ""and"" for clause. This helps you use phrasing, punctuation, and spelling accurately. What’s the best thing about travelling by train?"
"Secondly it 's not comfortable.becouse you every day drives instead of relaxing and enjoy the enviroment","Secondly, it's not comfortable because you drive every day instead of relaxing and enjoying the environment.","Logical reasoning! The error is phrasing, punctuation, and spelling. Add a comma after ""Secondly"" for clause. Change ""comfortable.becouse"" to ""comfortable, because"" for spelling and punctuation. Change ""every day drives"" to ""drive every day"" for tense. Change ""enjoy"" to ""enjoying"" for gerund. Change ""enviroment"" to ""environment"" for spelling. This helps you use phrasing, punctuation, and spelling correctly. What’s the best way to relax while travelling?"
"Using public transport has certain advantages and also, disadvantages.","Using public transport has certain advantages and also disadvantages.","Balanced view! The error is phrasing and punctuation. Remove comma after ""also"" for smoother flow. This helps you use phrasing and punctuation accurately. What’s the best thing about public transport?"
"It is said that people prefer going by bus to a close place, but some of then do n't think the same.","It is said that people prefer going by bus to a nearby place, but some of them don't think the same.","Interesting observation! The error is phrasing, punctuation, and spelling. Change ""close"" to ""nearby"" for adjective form. Change ""then"" to ""them"" for pronoun. Change ""do n't"" to ""don’t"" for contraction. This helps you use phrasing, punctuation, and spelling correctly. What’s the best thing about going by bus?"
"The public transport has plenty of advantages.","Public transport has plenty of advantages.","Clear statement! The error is phrasing. Remove ""The"" before ""public transport"" for consistency. This helps you use phrasing effectively. What’s the best advantage of public transport?"
"Some people ca n't afford to buy a car or to pay for oil, as it is constantly rising, so using a public transport is an economic way to travel.","Some people can't afford to buy a car or to pay for petrol, as the price is constantly rising, so using public transport is an economical way to travel.","Important point! The error is phrasing, punctuation, and spelling. Change ""ca n't"" to ""can’t"" for contraction. Change ""oil"" to ""petrol"" for context. Change ""it is"" to ""the price is"" for clarity. Remove ""a"" before ""public transport"" for consistency. Change ""economic"" to ""economical"" for adjective form. This helps you use phrasing, punctuation, and spelling accurately. What’s the best way to save money on travel?"
"On the other hand it helps to reduce the polution made by cars,..","On the other hand, it helps to reduce the pollution caused by cars.","Environmental benefit! The error is phrasing, punctuation, and spelling. Add a comma after ""hand"" for clause. Change ""polution"" to ""pollution"" for spelling. Change ""made by cars"" to ""caused by cars"" for phrasing. Remove "".."" for proper punctuation. This helps you use phrasing, punctuation, and spelling correctly. What’s the best way to reduce pollution?"
"Besides, it will be always useful for people ca n't drive.","Besides, it will always be useful for people who can't drive.","Helpful point! The error is phrasing, punctuation, and verb tense. Add a comma after ""Besides"" for clause. Change ""will be always"" to ""will always be"" for word order. Add ""who"" after ""people"" for relative clause. Change ""ca n't"" to ""can’t"" for contraction. This helps you use phrasing, punctuation, and verb tenses accurately. What’s the best thing about public transport for non-drivers?"
"Many people admit that if they could buy a car, they would do it.","Many people admit that if they could buy a car, they would do so.","Honest admission! The error is phrasing and punctuation. Add a comma after ""car"" for clause. Change ""do it"" to ""do so"" for formal phrasing. This helps you use phrasing and punctuation correctly. What’s the best thing about buying a car?"
"The reason is they are tired of using public transport and they would get earlier to everywhere.","The reason is that they are tired of using public transport, and they would get everywhere faster.","Logical reasoning! The error is phrasing, punctuation, and verb tense. Add ""that"" after ""is"" for clause. Add a comma before ""and"" for clause. Change ""get earlier to everywhere"" to ""get everywhere faster"" for phrasing. This helps you use phrasing, punctuation, and verb tenses accurately. What’s the best thing about having a car for travel?"
"In the future, cars would be so cheap than everyone will have one, thus, it will take up the end of the public transport.","In the future, cars will be so cheap that everyone will have one. Thus, it will mean the end of public transport.","Interesting prediction! The error is phrasing, punctuation, and verb tense. Change ""would be"" to ""will be"" for future tense. Change ""than"" to ""that"" for conjunction. Add a period after ""one"" for sentence break. Change ""take up the end of"" to ""mean the end of"" for phrasing. Remove ""the"" before ""public transport"" for consistency. This helps you use phrasing, punctuation, and verb tenses correctly. What’s the best thing about public transport’s future?"
"To sum up, I would say that people will use more and more public transport, as the oil is getting expensive.","To sum up, I would say that people will use public transport more and more, as petrol is getting expensive.","Optimistic outlook! The error is phrasing, punctuation, and verb tense. Add a comma after ""up"" for clause. Change ""more and more public transport"" to ""public transport more and more"" for word order. Change ""oil"" to ""petrol"" for context. This helps you use phrasing, punctuation, and verb tenses accurately. What’s the best thing about public transport becoming more popular?"
"The picture illustrate the progrocess of making notes.","The picture illustrates the process of making notes.","Clear description! The error is phrasing and spelling. Change ""illustrate"" to ""illustrates"" for subject-verb agreement. Change ""progrocess"" to ""process"" for spelling. This helps you use phrasing and spelling correctly. What’s the most important step in making notes?"
"There includes some most important steps.","This includes some of the most important steps.","Good introduction! The error is phrasing and article. Change ""There includes"" to ""This includes"" for subject clarity. Add ""of the"" before ""most important"" for phrasing. This helps you use phrasing and articles accurately. What’s the first step in making notes?"
"Design is the first and the most important process.","Design is the first and the most important process.","Clear statement! This sentence is grammatically correct. It uses proper phrasing and tense to describe a process. What’s the best thing about the design process?"
"It is the first step that costs troublesome, some things must be included the considerations, such as background colour, artwork, security issues.","It is the first step that costs trouble. Some things must be included in the considerations, such as background colour, artwork, and security issues.","Detailed explanation! The error is phrasing, punctuation, and verb tense. Change ""costs troublesome"" to ""costs trouble"" for phrasing. Add a period after ""trouble"" for sentence break. Change ""included the considerations"" to ""included in the considerations"" for preposition. Add ""and"" before ""security issues"" for list. This helps you use phrasing, punctuation, and verb tenses correctly. What’s the most important consideration in design?"
"Then, preparation of mental plates and skilled machinists are the needments.","Then, the preparation of metal plates and skilled machinists are needed.","Clear step! The error is phrasing and verb tense. Add ""the"" before ""preparation"" for article. Change ""mental"" to ""metal"" for spelling. Change ""needments"" to ""needed"" for proper form. This helps you use phrasing and verb tenses accurately. What’s the best thing about preparing metal plates?"
"Printing is the next step,.Usually, sheets of bank notes printed, because there are some special require for the printing, solour of both sides, special ink, images slightly raised.","Printing is the next step. Usually, sheets of banknotes are printed because there are some special requirements for the printing, such as the colour of both sides, special ink, and images slightly raised.","Detailed process! The error is phrasing, punctuation, and spelling. Remove comma after ""step"" and add a period for sentence break. Change ""notes"" to ""banknotes"" for compound word. Change ""printed"" to ""are printed"" for passive voice. Change ""require"" to ""requirements"" for plural. Change ""solour"" to ""colour"" for spelling. Add ""such as"" and ""and"" for list structure. This helps you use phrasing, punctuation, and spelling correctly. What’s the most important thing in printing banknotes?"
"The last step is the inspertion, sheete manually inspected.","The last step is the inspection. Sheets are manually inspected.","Final step! The error is phrasing, punctuation, and spelling. Change ""inspertion"" to ""inspection"" for spelling. Add a period after ""inspection"" for sentence break. Change ""sheete manually inspected"" to ""Sheets are manually inspected"" for subject and verb. This helps you use phrasing and punctuation accurately. What’s the best thing about inspecting banknotes?"
