"Input","Output","Updated Feedback"
"Dear Sir / Madam,","Dear Sir/Madam,","Formal greeting! The error is phrasing. Remove spaces around ""/"" for standard format. This helps you use phrasing effectively. What’s the best way to start a formal letter?"
"I am writing to apply a job for summer camp.","I am writing to apply for a job at a summer camp.","Clear purpose! The error is phrasing and preposition. Change ""to apply a job for summer camp"" to ""to apply for a job at a summer camp"" for preposition and article. This helps you use phrasing and prepositions accurately. What’s the most important thing to include in a job application?"
"My name is Jenny Wang and I would be the right person for the job.","My name is Jenny Wang, and I would be the right person for the job.","Confident introduction! The error is phrasing and punctuation. Add a comma before ""and"" for clause. This helps you use phrasing and punctuation correctly. What’s the best thing about applying for this job?"
"About me, I was born in 1989 and I live in Los Angeles since 2000.","I was born in 1989 and have lived in Los Angeles since 2000.","Clear background! The error is phrasing and verb tense. Remove ""About me"" for natural flow. Change ""live"" to ""have lived"" for present perfect tense. Remove comma after ""me."" This helps you use phrasing and verb tenses accurately. What’s the best thing about living in Los Angeles?"
"I came from a large family and I have two younger sisters with age of 10 and 12.","I come from a large family and have two younger sisters aged 10 and 12.","Family introduction! The error is phrasing and verb tense. Change ""came"" to ""come"" for present tense. Change ""with age of"" to ""aged"" for concise phrasing. This helps you use phrasing and verb tenses correctly. What’s the best thing about having younger sisters?"
"To introduce my skills, I passed all exams in English at school and I can speak English well.","To introduce my skills, I passed all exams in English at school, and I can speak English well.","Impressive skills! The error is phrasing and punctuation. Add a comma before ""and"" for clause. This helps you use phrasing and punctuation accurately. What’s the best thing about speaking English well?"
"I also have experience with teenagers through my sisters and I will look after them as I take care of my sisters.","I also have experience with teenagers through my sisters, and I will look after them as I take care of my sisters.","Valuable experience! The error is phrasing and punctuation. Add a comma before ""and"" for clause. This helps you use phrasing and punctuation correctly. What’s the best thing about working with teenagers?"
"Additionally, I am a hard worker and an active person.","Additionally, I am a hard worker and an active person.","Strong qualities! This sentence is grammatically correct. It uses proper phrasing and tense to describe characteristics. What’s the best thing about being a hard worker?"
"Regarding the work conditions, thank you for providing meals and accommodation and I willing to take the costs of the flight.","Regarding the work conditions, thank you for providing meals and accommodation, and I am willing to cover the cost of the flight.","Appreciative response! The error is phrasing, punctuation, and verb tense. Add a comma before ""and"" for clause. Add ""am"" after ""I"" for verb. Change ""take"" to ""cover"" for phrasing. Change ""costs"" to ""cost"" for singular. This helps you use phrasing, punctuation, and verb tenses accurately. What’s the best thing about the work conditions?"
"Finally, I am the right person for the job and I will do my best if I could have to chance to work for summer camp 2014.","Finally, I am the right person for the job, and I will do my best if I have the chance to work at a summer camp in 2014.","Enthusiastic closing! The error is phrasing, punctuation, and verb tense. Add a comma before ""and"" for clause. Change ""could have to chance"" to ""have the chance"" for structure. Change ""for summer camp"" to ""at a summer camp"" for preposition. This helps you use phrasing, punctuation, and verb tenses correctly. What’s the best thing about this job opportunity?"
"Thank you very much for your time and I look forward to having a positive news from you.","Thank you very much for your time, and I look forward to receiving positive news from you.","Polite closing! The error is phrasing, punctuation, and article. Add a comma before ""and"" for clause. Change ""having a positive news"" to ""receiving positive news"" for phrasing (remove ""a"" as ""news"" is uncountable). This helps you use phrasing, punctuation, and articles accurately. What’s the best way to end a job application letter?"
"Yours Sincerely,","Yours faithfully,","Formal closing! The error is phrasing. Change ""Sincerely"" to ""faithfully"" for formal letter closing with ""Dear Sir/Madam."" This helps you use phrasing effectively. What’s the best way to sign off a formal letter?"
"Jenny Wang","Jenny Wang","Simple signature! This sentence is grammatically correct. It uses proper phrasing and punctuation for a signature. What’s the best way to sign a letter?"
"First of all, I wanted to say sorry about a boring life.","First of all, I want to apologize for a boring life.","Sincere apology! The error is phrasing, punctuation, and verb tense. Add a comma after ""all"" for clause. Change ""wanted to say sorry"" to ""want to apologize"" for tense and formality. Change ""about"" to ""for"" for preposition. This helps you use phrasing, punctuation, and verb tenses accurately. What’s the best way to apologize for a boring life?"
"Sometimes I felt lonely, that I meant.","Sometimes I felt lonely, which I meant.","Honest feeling! The error is phrasing and punctuation. Change ""that I meant"" to ""which I meant"" for relative clause. This helps you use phrasing and punctuation correctly. What’s the best way to handle loneliness?"
"You knew everything about my health. I 've never hidden this information from you.","You knew everything about my health; I've never hidden this information from you.","Open communication! The error is phrasing and punctuation. Change period to semicolon for related clauses. This helps you use phrasing and punctuation accurately. What’s the best thing about sharing health information?"
"From first time I said about that to you I had a problem with my health but you answered: it not matter.","From the first time I said to you that I had a problem with my health, you answered, 'It does not matter.'","Honest conversation! The error is phrasing, punctuation, and verb tense. Add ""the"" before ""first time"" for article. Change ""said about that to you"" to ""said to you that"" for structure. Add a comma after ""health"" for clause. Change ""it not matter"" to ""It does not matter"" for capitalization and contraction. This helps you use phrasing, punctuation, and verb tenses correctly. What’s the best way to respond to health problems?"
"I felt so bad in a car.","I felt so bad in the car.","Clear description! The error is phrasing. Add ""the"" before ""car"" for specific context. This helps you use phrasing effectively. What’s the best way to handle feeling bad in a car?"
"I felt that I could lose my consciousness, that 's why I removed a braclet.","I felt that I could lose consciousness, which is why I removed a bracelet.","Serious moment! The error is phrasing, punctuation, and spelling. Change ""my consciousness"" to ""consciousness"" for natural phrasing. Change ""that 's why"" to ""which is why"" for relative clause. Change ""braclet"" to ""bracelet"" for spelling. This helps you use phrasing, punctuation, and spelling accurately. What’s the best thing to do when feeling unwell?"
"I really do n't feel my blame.","I really don't feel any guilt.","Honest admission! The error is phrasing and contraction. Change ""do n't"" to ""don’t"" for contraction. Change ""my blame"" to ""any guilt"" for phrasing. This helps you use phrasing and contractions correctly. What’s the best way to handle feelings of guilt?"
"I talk about everything.","I talked about everything.","Open communication! The error is phrasing and verb tense. Change ""talk"" to ""talked"" for past tense consistency. This helps you use phrasing and verb tenses accurately. What’s the best thing about talking openly?"
"Hello Lara.","Hello Lara,","Friendly greeting! The error is punctuation. Add a comma after ""Lara"" for greeting. This helps you use punctuation correctly. What’s the best way to greet someone?"
"I am glaed to hear frome you.","I am glad to hear from you.","Warm greeting! The error is phrasing and spelling. Change ""glaed"" to ""glad"" for spelling. Change ""frome"" to ""from"" for spelling. This helps you use phrasing and spelling accurately. What’s the best thing about hearing from a friend?"
"I am 24 years old I am frome Lviv Ukraine.","I am 24 years old. I am from Lviv, Ukraine.","Clear introduction! The error is phrasing, punctuation, and spelling. Add a period after ""old"" for sentence break. Change ""frome"" to ""from"" for spelling. Add a comma before ""Ukraine"" for place name. This helps you use phrasing, punctuation, and spelling correctly. What’s the best thing about being 24?"
"My hobbies are footbal and gym.","My hobbies are football and gym.","Active lifestyle! The error is phrasing and spelling. Change ""footbal"" to ""football"" for spelling. This helps you use phrasing and spelling accurately. What’s the best thing about your hobbies?"
"I have got 1 brother, Petr.","I have got one brother, Petr.","Family introduction! The error is phrasing and punctuation. Change ""1"" to ""one"" for word form. Add a comma before ""Petr"" for appositive. This helps you use phrasing and punctuation correctly. What’s the best thing about having a brother?"
"I am a PhD student in university.","I am a PhD student at university.","Impressive achievement! The error is phrasing. Change ""in"" to ""at"" for preposition. This helps you use phrasing effectively. What’s the best thing about being a PhD student?"
"I am stydying envaermantal saents.","I am studying environmental science.","Important field! The error is phrasing and spelling. Change ""stydying"" to ""studying"" for spelling. Change ""envaermantal saents"" to ""environmental science"" for spelling and word. This helps you use phrasing and spelling accurately. What’s the best thing about studying environmental science?"
"Evgeni.","Evgeni","Simple signature! The error is punctuation. Remove period if intended as a signature. This helps you use punctuation correctly. What’s the best way to sign off a letter?"
"Welcome in this town.","Welcome to this town.","Warm welcome! The error is phrasing. Change ""in"" to ""to"" for preposition. This helps you use phrasing effectively. What’s the best thing about welcoming someone to town?"
"We are here to introduce the shopping facilities and shops in this town to you.","We are here to introduce you to the shopping facilities and shops in this town.","Clear introduction! The error is phrasing. Change ""the shopping facilities and shops in this town to you"" to ""you to the shopping facilities and shops in this town"" for word order. This helps you use phrasing correctly. What’s the best thing about introducing shopping facilities?"
"Washing you enjoy it.","Wishing you enjoy it.","Kind wish! The error is phrasing. Change ""Washing"" to ""Wishing"" for meaning. This helps you use phrasing effectively. What’s the best way to wish someone enjoyment?"
"There are several big plazas in the center in the town.","There are several big plazas in the center of the town.","Clear description! The error is phrasing. Change ""in the center in the town"" to ""in the center of the town"" for preposition. This helps you use phrasing effectively. What’s the best thing about big plazas?"
"You can walk about ten minutes from the station or by bus to there.","You can get there in about ten minutes from the station or by bus.","Helpful direction! The error is phrasing. Change ""walk about ten minutes...to there"" to ""get there in about ten minutes"" for phrasing. This helps you use phrasing effectively. What’s the best way to get to the plazas?"
"There are shops, restaurants and cinemas in these plazas, including some well - known brands.","There are shops, restaurants, and cinemas in these plazas, including some well-known brands.","Great variety! The error is phrasing and punctuation. Add a comma before ""and"" for list structure. This helps you use phrasing and punctuation correctly. What’s the best thing about well-known brands?"
"You may be energetic or crazy by these charming shops where you are walking around.","You may feel energetic or crazy about these charming shops where you are walking around.","Fun experience! The error is phrasing. Change ""be energetic or crazy by"" to ""feel energetic or crazy about"" for natural phrasing. This helps you use phrasing effectively. What’s the best thing about charming shops?"
"If you feel like to eat something, there is a lot of well - known restaurants, and have different country meals.","If you feel like eating something, there are a lot of well-known restaurants, and they have different countries' dishes.","Delicious options! The error is phrasing, punctuation, and verb tense. Change ""feel like to eat"" to ""feel like eating"" for correct gerund form. Change ""is"" to ""are"" for subject-verb agreement with ""restaurants."" Add ""they"" after ""and"" for subject clarity. Change ""country meals"" to ""countries' dishes"" for possessive form and plural. This helps you use phrasing, punctuation, and verb tenses accurately. What’s the best thing about trying different dishes?"
"You can choose the taste you like.","You can choose the taste you like.","Great choice! This sentence is grammatically correct. It uses proper phrasing and tense to describe a choice. What’s your favorite taste?"
"After a long day of shopping, you might have spent all the money.","After a long day of shopping, you might have spent all your money.","Relatable situation! The error is phrasing. Change ""the money"" to ""your money"" for possessive clarity. This helps you use phrasing effectively. What’s the best way to manage spending money?"
"There 's a bank in each plaza.","There's a bank in each plaza.","Convenient service! The error is punctuation. Remove extra space before apostrophe. This helps you use punctuation correctly. What’s the best thing about having a bank nearby?"
"So, you can enjoy your time without money 's problem.","So, you can enjoy your time without money problems.","Positive outlook! The error is phrasing and punctuation. Remove ""s"" after ""money"" as it’s unnecessary. Change ""problem"" to ""problems"" for plural form. This helps you use phrasing and punctuation accurately. What’s the best way to enjoy time without money worries?"
"At night, there 's another side in this town.","At night, there's another side to this town.","Interesting description! The error is phrasing. Change ""in"" to ""to"" for preposition accuracy. This helps you use phrasing effectively. What’s the best thing about the town at night?"
"You can see all the streets are adorned by lighting.","You can see all the streets are adorned by lighting.","Beautiful scene! This sentence is grammatically correct. It uses proper phrasing and tense to describe a scene. What’s the best thing about street lighting?"
"This is one of the sort of the best quality here.","This is one of the best qualities here.","Clear description! The error is phrasing. Remove ""sort of the"" as it’s redundant and unclear. Change ""quality"" to ""qualities"" for plural consistency. This helps you use phrasing effectively. What’s the best quality of this town?"
"You might have a walk around after supper.","You might have a walk around after supper.","Relaxing activity! This sentence is grammatically correct. It uses proper phrasing and tense to describe an action. What’s the best thing about an evening walk?"
"my father","My father","Simple introduction! The error is phrasing. Capitalize ""my"" for sentence start. This helps you use phrasing effectively. What’s the best thing about your father?"
"my father name is Zaheer arat.he is very loving and caring.they gives us all the facilities one should have and dream of these things.he provides all the facilities to us of internet and books so that we can learn better and can be good students and get good marks in the examination.he always encouraged us and said do n't afraid of anything because you are braver than anything else.my brothers and me proud of my father.he is very hard working and brave.he has the smiley face.he always tries to laugh other people with their jokes.he always listens to us what we want.he never ever ignore us.","My father's name is Zaheer Arat. He is very loving and caring. He gives us all the facilities one should have and dream of, for example, the internet and books, so that we can learn better and can be good students and get good marks in the examination. He always encourages us and says not to be afraid of anything because you are braver than anything else. My brothers and I are proud of my father. He is very hardworking and brave. He has a smiley face. He always tries to make other people laugh with his jokes. He always listens to what we want. He never ever ignores us.","Heartwarming description! The error is phrasing, punctuation, and verb tense. Capitalize ""my"" for sentence start. Add ""s"" after ""father"" for possessive. Capitalize ""Arat"" and add period after ""Arat."" Change ""they gives"" to ""He gives"" for subject-verb agreement. Add comma after ""have"" for clause. Add ""for example"" with commas for clarity. Add period after ""things."" Change ""encouraged"" to ""encourages"" for present tense. Change ""said do n't afraid"" to ""says not to be afraid"" for structure. Change ""my brothers and me proud"" to ""My brothers and I are proud"" for subject and verb. Change ""hard working"" to ""hardworking"" for compound word. Remove ""the"" before ""smiley face."" Change ""laugh other people with their jokes"" to ""make other people laugh with his jokes"" for phrasing. Add ""to"" before ""what we want"" for clarity. Change ""ignore"" to ""ignores"" for subject-verb agreement. This helps you use phrasing, punctuation, and verb tenses accurately. What’s the best thing about your father’s support?"