"Input","Output","Updated Feedback"
"The inspection always have three results, the good quality sheets, the bad sheet or the partially damaged sheets.","The inspection always has three results: the good quality sheets, the bad sheets, or the partially damaged sheets.","Clear outcome! The error is phrasing, punctuation, and verb tense. Change ""have"" to ""has"" for subject-verb agreement. Change ""sheet"" to ""sheets"" for plural. Add a colon after ""results"" for list introduction. Add commas for list structure. This helps you use phrasing, punctuation, and verb tenses correctly. What’s the best way to handle inspection results?"
"If the print sheets has good quality, they will packing and distribution.some partially damaged will cut into separate or packede or dispatched.The bad sheets will disposal, the destroyed will be secure.","If the printed sheets are of good quality, they will be packed and distributed. Some partially damaged sheets will be cut into separate pieces, packed, or dispatched. The bad sheets will be disposed of, and the destruction will be secure.","Detailed process! The error is phrasing, punctuation, and verb tense. Change ""print sheets has"" to ""printed sheets are"" for tense and structure. Add ""of"" after ""are"" for phrasing. Change ""will packing and distribution"" to ""will be packed and distributed"" for passive voice. Add a period after ""distributed"" for sentence break. Change ""packede"" to ""packed"" for spelling. Change ""disposal"" to ""disposed of"" for phrasing. Change ""destroyed will be secure"" to ""destruction will be secure"" for clarity. This helps you use phrasing, punctuation, and verb tenses accurately. What’s the best thing about handling banknote quality?"
"My favorite sport is swimming.","My favorite sport is swimming.","Great choice! This sentence is grammatically correct. It uses proper phrasing and tense to describe a preference. What’s the best thing about swimming?"
"I goes swimming since 1998, when I had ten years old.","I have been going swimming since 1998, when I was ten years old.","Long-term hobby! The error is phrasing and verb tense. Change ""goes"" to ""have been going"" for present perfect continuous tense. Change ""had ten years old"" to ""was ten years old"" for natural phrasing. This helps you use phrasing and verb tenses correctly. What’s the best thing about swimming since childhood?"
"I like swimming because I feel a good sensation and my health is good.","I like swimming because I feel a good sensation, and my health is good.","Healthy habit! The error is phrasing and punctuation. Add a comma before ""and"" for clause separation. This helps you use phrasing and punctuation accurately. What’s the best thing about swimming for health?"
"Actually I not practice because I am not time, But a feel miss!","At the moment, I do not practice because I do not have time, but I miss it!","Honest admission! The error is phrasing, punctuation, and verb tense. Change ""Actually I not practice"" to ""At the moment, I do not practice"" for phrasing and tense. Change ""I am not time"" to ""I do not have time"" for structure. Change ""But a feel miss"" to ""but I miss it"" for subject and object. Adjust punctuation. This helps you use phrasing, punctuation, and verb tenses accurately. What’s the best way to find time for swimming?"
"Now I go to the gym and practice weight lifting three Times A week, Exercises aerobics every days and yoga two times a week!","Now I go to the gym and practice weightlifting three times a week, do aerobic exercises every day, and do yoga twice a week.","Active lifestyle! The error is phrasing, punctuation, and verb tense. Change ""Times A week"" to ""times a week"" for lowercase. Change ""Exercises aerobics every days"" to ""do aerobic exercises every day"" for verb and spelling. Change ""two times a week"" to ""twice a week"" for phrasing. This helps you use phrasing, punctuation, and verb tenses correctly. What’s the best thing about a varied exercise routine?"
"I every feel very well after come back the gym.","I always feel very well after coming back from the gym.","Positive feeling! The error is phrasing, punctuation, and verb tense. Change ""every"" to ""always"" for adverb. Change ""come back"" to ""coming back"" for gerund. Add ""from"" before ""the gym"" for preposition. This helps you use phrasing, punctuation, and verb tenses accurately. What’s the best thing about going to the gym?"
"Often I go to the gym with my friend, Vanessa,","Often, I go to the gym with my friend, Vanessa,","Social exercise! The error is phrasing and punctuation. Add a comma after ""Often"" for clause. This helps you use phrasing and punctuation correctly. What’s the best thing about going to the gym with a friend?"
"But when she ca n't go I go Alone.","But when she can't go, I go alone.","Independent spirit! The error is phrasing, punctuation, and verb tense. Change ""ca n't"" to ""can’t"" for contraction. Add a comma after ""go"" for clause. Change ""Alone"" to ""alone"" for lowercase. This helps you use phrasing, punctuation, and verb tenses accurately. What’s the best thing about going to the gym alone?"
"I always go!","I always go!","Determined attitude! This sentence is grammatically correct. It uses proper phrasing and tense to describe an action. What’s the best thing about consistency in exercise?"
"My cough is very friendly and help me","My coach is very friendly and helps me.","Supportive coach! The error is phrasing and verb tense. Change ""cough"" to ""coach"" for meaning. Change ""help"" to ""helps"" for subject-verb agreement. This helps you use phrasing and verb tenses correctly. What’s the best thing about having a friendly coach?"
"The television is one of the most important AV media in the world.","Television is one of the most important AV media in the world.","Clear statement! The error is phrasing. Remove ""The"" before ""television"" for consistency. This helps you use phrasing effectively. What’s the best thing about television?"
"You can use it for many purposes, according to your needs.There are a lot of channels in many roles, for instance, education, movies, songs, sports, news and so on.The television is not only for entertainment but also for education.The television can entertain you through it 's entertained channels, and the television can educate you through it 's educational channels.","You can use it for many purposes, according to your needs. There are a lot of channels playing many roles, for instance, education, movies, songs, sports, news, and so on. Television is not only for entertainment but also for education. Television can entertain you through its entertainment channels, and television can educate you through its educational channels.","Comprehensive explanation! The error is phrasing, punctuation, and spelling. Add a period after ""needs"" for sentence break. Change ""in many roles"" to ""playing many roles"" for phrasing. Add ""and"" before ""so on"" for list. Change ""The television"" to ""Television"" for consistency. Change ""it 's entertained channels"" to ""its entertainment channels"" for possessive and meaning. Change ""it 's educational channels"" to ""its educational channels"" for possessive. This helps you use phrasing, punctuation, and spelling accurately. What’s the best thing about television’s versatility?"
"At this time and age, most of the people have their own car or vehicle for their transportation.","In this day and age, most people have their own car or vehicle for their transportation.","Modern reality! The error is phrasing and article. Change ""At this time and age"" to ""In this day and age"" for idiom. Remove ""of the"" before ""people"" for natural phrasing. This helps you use phrasing and articles effectively. What’s the best thing about having a personal vehicle?"
"It is also make convenient for people who are rushing time to work, meeting and so on.","It also makes it convenient for people who are rushing to work, meetings, and so on.","Helpful convenience! The error is phrasing, punctuation, and verb tense. Change ""is also make convenient"" to ""also makes it convenient"" for structure. Remove ""time"" after ""rushing"" as it’s implied. Change ""meeting"" to ""meetings"" for plural. This helps you use phrasing, punctuation, and verb tenses accurately. What’s the best thing about convenience in transportation?"
"However, I have no agree with this statement because the public transport is needed for someone who are no have vehicle or economic downturn.","However, I do not agree with this statement because public transport is needed by people who do not have vehicles or during economic downturns.","Balanced view! The error is phrasing, punctuation, and verb tense. Add ""do"" and ""not"" after ""I have no"" for structure. Remove ""the"" before ""public transport"" for consistency. Change ""someone who are no have vehicle"" to ""people who do not have vehicles"" for grammar. Change ""economic downturn"" to ""economic downturns"" for plural. This helps you use phrasing, punctuation, and verb tenses correctly. What’s the best thing about public transport for those in need?"
"Public transport is cheap and friendly for environment.","Public transport is cheap and friendly to the environment.","Environmental benefit! The error is phrasing and preposition. Change ""for environment"" to ""to the environment"" for preposition and article. This helps you use phrasing and prepositions accurately. What’s the best thing about public transport’s environmental impact?"
"firstly, the fare of public transport is cheaper compared with buying a new car.","Firstly, the fare for public transport is cheaper compared with buying a new car.","Good comparison! The error is phrasing, punctuation, and preposition. Capitalize ""Firstly"" for sentence start. Change ""of"" to ""for"" for preposition. This helps you use phrasing, punctuation, and prepositions correctly. What’s the best thing about public transport’s affordability?"
"The person that do not have to save large amount of money to buy the car.","People who do not have to save large amounts of money to buy a car.","Logical reasoning! The error is phrasing, punctuation, and verb tense. Change ""The person that do not have"" to ""People who do not have"" for plural and relative clause. Change ""amount of money"" to ""amounts of money"" for plural. Remove ""the"" before ""car"" for consistency. This helps you use phrasing, punctuation, and verb tenses accurately. What’s the best thing about not needing to save for a car?"
"They can use the money in more useful or meaningful way such as investment property.","They can use the money in a more useful or meaningful way, such as investing in property.","Smart financial advice! The error is phrasing, punctuation, and verb tense. Add ""a"" before ""more useful"" for article. Add a comma before ""such as"" for clause. Change ""investment property"" to ""investing in property"" for phrasing. This helps you use phrasing, punctuation, and verb tenses correctly. What’s the best thing to invest in?"
"The fare of public transport is less than own vehicle when compared fare of bus to fulfill whole tank of oil.","The fare for public transport is less than owning a vehicle when you compare bus fares to filling a whole tank with petrol.","Cost-effective comparison! The error is phrasing, punctuation, and verb tense. Change ""of"" to ""for"" for preposition. Change ""own vehicle"" to ""owning a vehicle"" for gerund. Change ""compared fare of bus"" to ""you compare bus fares"" for structure. Change ""fulfill whole tank of oil"" to ""filling a whole tank with petrol"" for phrasing. This helps you use phrasing, punctuation, and verb tenses accurately. What’s the best way to save money on transportation?"
"Some more they are needed to pay a parking fee for parking.","In addition, they need to pay a parking fee for parking.","Additional cost! The error is phrasing and verb tense. Change ""Some more"" to ""In addition"" for transition. Change ""are needed to pay"" to ""need to pay"" for active voice. This helps you use phrasing and verb tenses correctly. What’s the best way to avoid parking fees?"
"Secondly, air pollution is a serious problem nowadays.","Secondly, air pollution is a serious problem nowadays.","Important issue! This sentence is grammatically correct. It uses proper phrasing and tense to describe a problem. What’s the best way to reduce air pollution?"
"Because of everybody has to leave for another place through their own car and carbon dioxide released from the car.","Because everyone has to travel to another place in their own car, carbon dioxide is released from the cars.","Environmental concern! The error is phrasing, punctuation, and verb tense. Change ""Because of everybody has to leave"" to ""Because everyone has to travel"" for structure. Change ""through their own car"" to ""in their own car"" for preposition. Change ""carbon dioxide released from the car"" to ""carbon dioxide is released from the cars"" for passive voice and plural. This helps you use phrasing, punctuation, and verb tenses accurately. What’s the best way to reduce carbon emissions?"
"The public transport is a way to reduce the air pollution because it can carry more than a dozen times the people in a time and reduce their own vehicle.","Public transport is a way to reduce air pollution because it can carry more than a dozen times the number of people at a time and reduce the number of people travelling in their own vehicles.","Effective solution! The error is phrasing, punctuation, and verb tense. Remove ""The"" before ""public transport"" for consistency. Remove ""the"" before ""air pollution"" for natural phrasing. Change ""in a time"" to ""at a time"" for idiom. Change ""reduce their own vehicle"" to ""reduce the number of people travelling in their own vehicles"" for clarity. This helps you use phrasing, punctuation, and verb tenses correctly. What’s the best thing about public transport for the environment?"
"So, it can also help to reduce the traffic jam problem.","So, it can also help to reduce the traffic jam problem.","Great benefit! This sentence is grammatically correct. It uses proper phrasing and tense to describe a benefit. What’s the best way to reduce traffic jams?"
"Lastly, public transport that are always blamed by the people that are slowly and trouble than own vehicle.","Lastly, public transport is always blamed by people for being slow and troublesome compared to owning a vehicle.","Balanced perspective! The error is phrasing, punctuation, and verb tense. Add ""is"" after ""public transport"" for verb. Change ""that are slowly and trouble"" to ""for being slow and troublesome"" for phrasing. Change ""than own vehicle"" to ""compared to owning a vehicle"" for structure. This helps you use phrasing, punctuation, and verb tenses accurately. What’s the best thing about public transport despite its flaws?"
"Although the public transport is slow but it also do not take a long time of people to reach their destination because public transport nowadays are developed more fast and enough.","Although public transport is slow, it also does not take a long time for people to reach their destination because public transport nowadays is developed faster and sufficiently.","Optimistic view! The error is phrasing, punctuation, and verb tense. Remove ""the"" before ""public transport"" for consistency. Remove ""but"" after ""slow"" as it’s redundant. Change ""do not take"" to ""does not take"" for subject-verb agreement. Change ""of people"" to ""for people"" for preposition. Change ""are developed more fast and enough"" to ""is developed faster and sufficiently"" for grammar and meaning. This helps you use phrasing, punctuation, and verb tenses correctly. What’s the best thing about public transport’s development?"
"In conclusion, public transport is needed for everybody in a necessary time.","In conclusion, public transport is needed by everyone during necessary times.","Strong conclusion! The error is phrasing and punctuation. Add a comma after ""conclusion"" for clause. Change ""for everybody in a necessary time"" to ""by everyone during necessary times"" for phrasing. This helps you use phrasing and punctuation accurately. What’s the best thing about public transport’s necessity?"
"It always can make us save the money and make the environment more nature and fresh.","It can always help us save money and make the environment more natural and fresh.","Positive impact! The error is phrasing and verb tense. Change ""always can make"" to ""can always help"" for word order and verb. Change ""save the money"" to ""save money"" for uncountable noun. Change ""more nature"" to ""more natural"" for adjective form. This helps you use phrasing and verb tenses correctly. What’s the best thing about saving money and the environment?"
"Nowadays, the space for countries enlarges, instead of which, the area for farmland, forests and wetland is getting smaller.","Nowadays, the space needed for countries is expanding, whereas the area for farmland, forests, and wetlands is getting smaller.","Important observation! The error is phrasing, punctuation, and verb tense. Add a comma after ""Nowadays"" for clause. Change ""enlarges"" to ""is expanding"" for tense. Change ""instead of which"" to ""whereas"" for conjunction. Change ""wetland"" to ""wetlands"" for plural. This helps you use phrasing, punctuation, and verb tenses accurately. What’s the best way to protect farmland and forests?"
"This kind of situation brings all kinds of problems to mankind and animals.","This kind of situation brings all kinds of problems for mankind and animals.","Serious concern! The error is phrasing. Change ""to"" to ""for"" for preposition accuracy. This helps you use phrasing effectively. What’s the best way to address problems for mankind and animals?"
"The large - scale building projects took the space which should belong to the animals.","Large-scale building projects have taken the space that should belong to the animals.","Critical issue! The error is phrasing, punctuation, and verb tense. Remove ""The"" before ""large-scale"" for consistency. Change ""took"" to ""have taken"" for present perfect tense. Change ""which"" to ""that"" for relative clause. This helps you use phrasing, punctuation, and verb tenses correctly. What’s the best way to protect animal habitats?"
"The food for them and their living space might not be enough.","The food for them and their living space might not be enough.","Clear statement! This sentence is grammatically correct. It uses proper phrasing and tense to describe a situation. What’s the best way to ensure enough food and space for animals?"
"Some kinds of animals would move to the urban area, steal the food from us and sleep on the streets or in the underground.","Some kinds of animals will move to urban areas, steal food from us, and sleep on the streets or in the underground.","Urban challenge! The error is phrasing, punctuation, and verb tense. Change ""would move"" to ""will move"" for future tense. Change ""urban area"" to ""urban areas"" for plural. Add commas for list structure. This helps you use phrasing, punctuation, and verb tenses accurately. What’s the best way to handle animals in urban areas?"
"However, most of them might be arrested.only a little number of them might be adopted by those friendly human.","Although most of them might be caught, only a small number of them might be adopted by those friendly humans.","Animal welfare concern! The error is phrasing, punctuation, and verb tense. Change ""However"" to ""Although"" for contrast. Change ""arrested"" to ""caught"" for synonym. Capitalize ""only"" for sentence start. Change ""a little number"" to ""a small number"" for phrasing. Change ""human"" to ""humans"" for plural. This helps you use phrasing, punctuation, and verb tenses correctly. What’s the best way to help animals in need?"
"On the other hand, the expansion of city increase pollution of all kinds of garbage. The air pollution is much more serious now, and watching the blue sky is almost impossible in some big cities.","On the other hand, the expansion of a city increases pollution and all kinds of garbage. Air pollution is much more serious now, and seeing the blue sky is almost impossible in some big cities.","Environmental impact! The error is phrasing, punctuation, and verb tense. Add ""a"" before ""city"" for article. Change ""increase"" to ""increases"" for subject-verb agreement. Change ""of all kinds of garbage"" to ""and all kinds of garbage"" for structure. Change ""watching"" to ""seeing"" for verb choice. This helps you use phrasing, punctuation, and verb tenses accurately. What’s the best way to reduce pollution in cities?"
"Although the medical skills get stronger, the percentage of people who get cancer is still improving.","Although medical skills are getting better, the percentage of people who get cancer is still increasing.","Health concern! The error is phrasing and verb tense. Remove ""the"" before ""medical skills"" for consistency. Change ""get stronger"" to ""are getting better"" for phrasing. Change ""improving"" to ""increasing"" for context. This helps you use phrasing and verb tenses correctly. What’s the best way to address increasing cancer rates?"
"In conclusion, the large - scale building projects take the living resource from animals, increase the possibility of getting cancer and so on.","In conclusion, large-scale building projects take living resources from animals, increase the possibility of getting cancer, and so on.","Strong conclusion! The error is phrasing, punctuation, and verb tense. Remove ""the"" before ""large-scale"" for consistency. Change ""resource"" to ""resources"" for plural. Add a comma before ""and"" for list. This helps you use phrasing, punctuation, and verb tenses accurately. What’s the best way to mitigate the impact of building projects?"
"Only if the government develop more technical property, pay more attention to the environment protection, such as build more trees and grass in the cities, and set a special low for those missed animals will help decrease the harm that the building project brings to us.","Only if the government develops more technical property, pays more attention to environmental protection, such as planting more trees and grass in the cities, and sets a special law for those missing animals will we help decrease the harm that building projects bring to us.","Actionable solution! The error is phrasing, punctuation, and verb tense. Change ""develop"" to ""develops"" for subject-verb agreement. Change ""pay"" to ""pays"" for agreement. Change ""environment protection"" to ""environmental protection"" for adjective. Change ""build"" to ""planting"" for gerund. Change ""low"" to ""law"" for spelling. Change ""missed animals"" to ""missing animals"" for meaning. Change ""will help"" to ""will we help"" for subject-verb inversion. Change ""project"" to ""projects"" for plural. This helps you use phrasing, punctuation, and verb tenses correctly. What’s the best thing the government can do for the environment?"
"For me, my family members are not my best friends although I wish they are.","For me, my family members are not my best friends, although I wish they were.","Honest reflection! The error is phrasing and punctuation. Add a comma after ""me"" for clause. Add a comma before ""although"" for clause. Change ""are"" to ""were"" for subjunctive mood. This helps you use phrasing and punctuation accurately. What’s the best thing about family relationships?"
"If they are your best fiends they will guide you and help you to be to be the best of you, they wo n't hurt you or turn their back on you.","If they are your best friends, they will guide you and help you to be the best version of yourself; they won't hurt you or turn their backs on you.","Supportive relationships! The error is phrasing, punctuation, and verb tense. Change ""fiends"" to ""friends"" for spelling. Add a comma after ""friends"" for clause. Remove one ""to be"" for redundancy. Change ""the best of you"" to ""the best version of yourself"" for phrasing. Change ""back"" to ""backs"" for plural. Use a semicolon before ""they"" for clause separation. Change ""wo n't"" to ""won’t"" for contraction. This helps you use phrasing, punctuation, and verb tenses correctly. What’s the best thing about having best friends?"
"But on the other hand you maybe punished or they may yell at you when you do something wrong.","But on the other hand, you may be punished, or they may yell at you when you do something wrong.","Balanced view! The error is phrasing and punctuation. Add a comma after ""hand"" for clause. Change ""you maybe punished"" to ""you may be punished"" for structure. Add a comma before ""or"" for clause. This helps you use phrasing and punctuation accurately. What’s the best way to handle punishment from family?"
"So it is not always a good thing, unless they are open - minded or have their own methods to punish you in a gentil way that wo n't make you regret telling them your faults or mistakes.","So it is not always a good thing unless they are open-minded or have their own methods to punish you in a gentle way that won't make you regret telling them your faults or mistakes.","Thoughtful conclusion! The error is phrasing, punctuation, and verb tense. Remove comma after ""thing"" as ""unless"" doesn’t require it. Remove hyphen in ""open - minded"" for compound adjective. Change ""gentil"" to ""gentle"" for spelling. Change ""wo n't"" to ""won’t"" for contraction. This helps you use phrasing, punctuation, and verb tenses correctly. What’s the best way to handle family discipline?"
