"Input","Output","Updated Feedback"
"We told them that had to leave our house immediately.","We told them that they had to leave our house immediately.","Clear instruction! The error is subject clarity. Add ""they"" after ""that"" for correct subject. This helps you use pronouns effectively. What’s the most important thing to do when asking someone to leave?"
"When everyone was out, we told of Matias because he organised a party without our permission.","When everyone was out, we told Matias off because he organised a party without our permission.","Firm response! The error is phrasing and spelling. Remove ""of"" after ""told"" and add ""Matias"" as the direct object. Change ""organised"" to ""organized"" for consistency (though both are acceptable depending on regional spelling). This helps you use phrasing and spelling accurately. What’s the best way to handle someone breaking the rules?"
"He told us that he was really embarrassed about what had happened and he apologysed for her attitude","He told us that he was really embarrassed about what had happened, and he apologised for his attitude.","Honest apology! The error is spelling, punctuation, and pronoun. Change ""apologysed"" to ""apologised"" for spelling (British English). Change ""her"" to ""his"" to match the subject ""he."" Add a comma before ""and"" for clause separation. This helps you use spelling, punctuation, and pronouns correctly. What’s the best way to respond to an apology?"
"In my opinion, in future people do n't be used public transport.","In my opinion, in the future people will not use public transport.","Interesting prediction! The error is phrasing, article, and verb tense. Add ""the"" before ""future"" for specificity. Change ""do n't be used"" to ""will not use"" for proper tense and structure. Capitalize ""will"" for sentence start after conjunction. This helps you use phrasing, articles, and verb tenses accurately. What’s the best alternative to public transport in the future?"
"It will be not tredy because everybody will have his own car.","It will not be trendy because everybody will have his own car.","Logical reasoning! The error is phrasing and spelling. Change ""will be not tredy"" to ""will not be trendy"" for correct word order and spelling. This helps you use phrasing and spelling correctly. What’s the most important thing to consider when choosing a car?"
"These cars will be used alternative energy, for example energy of the Sun.","These cars will use alternative energy, for example energy from the Sun.","Great innovation! The error is phrasing and preposition. Change ""be used"" to ""use"" for active voice. Change ""energy of the Sun"" to ""energy from the Sun"" for preposition accuracy. This helps you use phrasing and prepositions accurately. What’s the best type of alternative energy for cars?"
"The modern science try to find new, more economic sources by energy.","Modern science is trying to find new, more economical sources of energy.","Important research! The error is phrasing, article, and verb tense. Remove ""The"" for proper noun usage. Change ""try"" to ""is trying"" for subject-verb agreement and tense. Change ""economic"" to ""economical"" for adjective form. Change ""by energy"" to ""of energy"" for preposition accuracy. This helps you use phrasing, articles, and verb tenses correctly. What’s the most promising source of energy?"
"do you have best friend in your life?","Do you have a best friend in your life?","Thoughtful question! The error is capitalization and article. Capitalize ""Do"" for sentence start. Add ""a"" before ""best friend"" for article usage. This helps you use capitalization and articles accurately. What’s the most important quality in a best friend?"
"what the meaning of friend?","What is the meaning of friend?","Good question! The error is capitalization and phrasing. Capitalize ""What"" for sentence start. Add ""is"" after ""What"" for proper structure. This helps you use capitalization and phrasing correctly. What’s the best way to define friendship?"
"friend is people who will be there in your hard time and happy time, and friend is always encourage you all things you choose in your life.","A friend is a person who will be there in your hard times and happy times, and a friend always encourages you in all the things you choose in your life.","Beautiful definition! The error is phrasing, punctuation, and verb tense. Add ""A"" before ""friend"" for article. Change ""people"" to ""person"" for singular agreement. Change ""time"" to ""times"" for plural consistency. Add ""a"" before ""friend"" in the second clause. Change ""encourage"" to ""encourages"" for subject-verb agreement. Add ""in"" before ""all"" and ""the"" before ""things"" for clarity. Add commas for clause separation. This helps you use phrasing, punctuation, and verb tenses accurately. What’s the best thing a friend has done for you?"
"friend is also be there when you sad and worse time. there is not ex'friend so respect your friend and they will more respect to you.","A friend will also be there when you are sad and in worse times. There is no ex-friend, so respect your friend, and they will respect you more.","Strong advice! The error is phrasing, punctuation, and verb tense. Add ""A"" before ""friend"" for article. Change ""is also be"" to ""will also be"" for tense and structure. Add ""are"" after ""you"" and ""in"" before ""worse"" for grammar. Change ""time"" to ""times"" for plural. Capitalize ""There"" for sentence start. Change ""not ex'friend"" to ""no ex-friend"" for clarity and spelling. Add a comma before ""and"" for clause separation. Change ""more respect to you"" to ""respect you more"" for natural phrasing. This helps you use phrasing, punctuation, and verb tenses correctly. What’s the best way to show respect to a friend?"
"Secondly, the student have a good body shape can easily to make new friends, and joining a sports team allows students to maintain good body shape.","Secondly, the student who has a good body shape can easily make new friends, and joining a sports team allows students to maintain a good body shape.","Great point! The error is phrasing, punctuation, and article. Add ""who"" after ""student"" for relative clause. Change ""have"" to ""has"" for subject-verb agreement. Remove ""to"" before ""make"" for correct infinitive form. Add ""a"" before ""good body shape"" in the second clause for article consistency. This helps you use phrasing, punctuation, and articles accurately. What’s the best way to make new friends?"
"For instances, the students joining the sports team needs to do some basic physical training to maintain their body shape.","For instance, the students joining the sports team need to do some basic physical training to maintain their body shape.","Clear example! The error is phrasing and verb tense. Change ""instances"" to ""instance"" for singular form. Change ""needs"" to ""need"" for subject-verb agreement with ""students."" This helps you use phrasing and verb tenses correctly. What’s the best type of physical training for students?"
"According, the boy or girl have strong muscles can let them look more attractive.","According to a boy or girl having strong muscles can make them look more attractive.","Interesting observation! The error is phrasing and verb tense. Add ""to"" after ""According"" for preposition. Add ""a"" before ""boy"" for article. Change ""have"" to ""having"" for gerund form. Change ""can let them look"" to ""can make them look"" for natural phrasing. This helps you use phrasing and verb tenses accurately. What’s the best way to stay attractive?"
"Therefore, the student joining a sport team can maintain good body shape and it will let student become easier to make new friends.","Therefore, the student joining a sports team can maintain a good body shape, and it will make students more easily able to make new friends.","Logical conclusion! The error is phrasing, punctuation, and verb tense. Change ""sport team"" to ""sports team"" for plural form. Add ""a"" before ""good body shape"" for article. Add a comma before ""and"" for clause separation. Change ""let student become easier to make"" to ""make students more easily able to make"" for clarity and grammar. This helps you use phrasing, punctuation, and verb tenses correctly. What’s the best thing about joining a sports team?"
"Peter looked at his watch and knew he had to do something immediately.","Peter looked at his watch and knew he had to do something immediately.","Clear action! This sentence is grammatically correct. It uses proper phrasing and tense to describe an action. What’s the most important thing to do in an emergency?"
"It is said that when you survive to a situation which has made you be at the limit, you change.","It is said that when you survive a situation that has taken you to the limit, you change.","Deep insight! The error is phrasing and verb tense. Remove ""to"" after ""survive"" for correct preposition. Change ""which has made you be at the limit"" to ""that has taken you to the limit"" for concise phrasing. This helps you use phrasing and verb tenses accurately. What’s the most challenging situation you’ve survived?"
"And you can never return to be the one you used to be.","And you can never return to being the person you used to be.","Powerful reflection! The error is phrasing and verb tense. Change ""to be"" to ""to being"" for gerund form. Change ""one"" to ""person"" for clarity. This helps you use phrasing and verb tenses correctly. What’s the most important lesson you’ve learned from change?"
"You are no more the person that people have expected.","You are no longer the person that people knew.","Thought-provoking! The error is phrasing and verb tense. Change ""no more"" to ""no longer"" for natural phrasing. Change ""have expected"" to ""knew"" for tense consistency. This helps you use phrasing and verb tenses accurately. What’s the best way to handle people’s expectations?"
"But you do n't care about it.","But you don't care about it.","Honest statement! The error is phrasing and contraction. Change ""do n't"" to ""don’t"" for contraction. This helps you use phrasing and contractions correctly. What’s the best thing to do when you don’t care about something?"
"Every hard situation may be got over easily when you make a big effort.","Every hard situation can be overcome easily when you make a big effort.","Motivational advice! The error is phrasing and verb tense. Change ""may be got over"" to ""can be overcome"" for natural phrasing and tense. This helps you use phrasing and verb tenses accurately. What’s the best way to overcome a hard situation?"
"Peter has been thinking about this secret party for months since the time he knew his mother was healed.","Peter had been thinking about this secret party for months since the time he knew his mother was healed.","Sweet gesture! The error is phrasing and verb tense. Change ""has been thinking"" to ""had been thinking"" for past perfect tense to match the sequence of events. This helps you use phrasing and verb tenses correctly. What’s the best way to celebrate a special moment?"
"He was taking care of her so that he was prevented from going to university.","He had been taking care of her, so he was prevented from going to university.","Sacrificial act! The error is phrasing, punctuation, and verb tense. Change ""was taking"" to ""had been taking"" for past perfect tense. Add a comma before ""so"" for clause separation. This helps you use phrasing, punctuation, and verb tenses accurately. What’s the most important thing to do for family?"
"He had to refuse to all his dreams suddenly.","He had to give up all his dreams suddenly.","Heartbreaking moment! The error is phrasing. Change ""refuse to"" to ""give up"" for natural phrasing. Remove ""to"" after ""refuse"" as it’s unnecessary. This helps you use phrasing effectively. What’s the best way to handle giving up dreams?"
"However, the destiny has given him another chance to follow them.","However, destiny had given him another chance to follow them.","Hopeful turn! The error is phrasing and verb tense. Remove ""the"" before ""destiny"" for proper noun usage. Change ""has given"" to ""had given"" for past perfect tense. This helps you use phrasing and verb tenses correctly. What’s the best thing to do with a second chance?"
"Despite his strange behaviour, Peter 's mum did n't expect it at all.","Despite his strange behaviour, Peter's mum didn't expect it at all.","Surprising reaction! The error is phrasing and contraction. Add a space after ""Peter"" before the apostrophe for correct possessive form. Change ""did n't"" to ""didn’t"" for contraction. This helps you use phrasing and contractions accurately. What’s the best way to handle unexpected news?"
"She felt blessed as she was given such a perfect son.","She felt blessed as she had been given such a perfect son.","Sweet sentiment! The error is phrasing and verb tense. Change ""was given"" to ""had been given"" for past perfect tense to match the context. This helps you use phrasing and verb tenses correctly. What’s the best thing about having a perfect son?"
"It is said to happen once in life.","It is said to happen once in a lifetime.","Meaningful saying! The error is phrasing. Change ""in life"" to ""in a lifetime"" for idiomatic expression. This helps you use phrasing effectively. What’s the most important thing to do once in a lifetime?"
"Peter has been kissed by her mum before, but this time was quite different.","Peter had been kissed by his mum before, but this time was quite different.","Emotional moment! The error is phrasing and verb tense. Change ""has been kissed"" to ""had been kissed"" for past perfect tense. Change ""her mum"" to ""his mum"" for consistency with ""Peter."" This helps you use phrasing and verb tenses accurately. What’s the most memorable kiss you’ve received?"
"Maybe he did n't notice it at all, but it was a farewell.","Maybe he didn't notice it at all, but it was a farewell.","Poignant moment! The error is phrasing and contraction. Change ""did n't"" to ""didn’t"" for contraction. This helps you use phrasing and contractions correctly. What’s the best way to say goodbye?"
"Now Peter could fly on his own.","Now Peter could fly on his own.","Empowering statement! This sentence is grammatically correct. It uses proper phrasing and tense to describe an action. What’s the best thing about becoming independent?"
"Environment is the combination of air, earth, water forest and all these are interlinked with each other.","The environment is a combination of air, earth, water, forests, and all these things are interlinked with each other.","Clear definition! The error is phrasing, punctuation, and article. Add ""The"" before ""environment"" for article. Change ""water forest"" to ""water, forests"" for plural and comma. Add ""things"" after ""all these"" for clarity. This helps you use phrasing, punctuation, and articles accurately. What’s the most important part of the environment?"
"Most importantly, all species of animals and human being are the part of this ecosystem.","Most importantly, all species of animals and human beings are a part of this ecosystem.","Important point! The error is phrasing and article. Change ""human being"" to ""human beings"" for plural. Change ""the part"" to ""a part"" for article usage. This helps you use phrasing and articles correctly. What’s the best way to protect the ecosystem?"
"Human is the most wise and intelligent from all of these.","The human being is the most wise and intelligent of all of these.","Interesting comparison! The error is phrasing and article. Add ""The"" before ""human being"" for article. Change ""from"" to ""of"" for preposition accuracy. This helps you use phrasing and articles accurately. What’s the most important thing humans can do for the environment?"
"However, he is mainly responsible for disturbing this ecosystem with various activities.","However, he is mainly responsible for disturbing this ecosystem through various activities.","Critical observation! The error is phrasing. Change ""with"" to ""through"" for preposition accuracy. This helps you use phrasing effectively. What’s the best way to reduce human impact on the ecosystem?"
"Lets talk about one of them, that is ' cleanliness ' Nowadays, we all know that we are spreading the garbage near our houses and offices.","Let's talk about one of them, which is 'cleanliness'. Nowadays, we all know that we are dumping garbage near our houses and offices.","Important topic! The error is phrasing, punctuation, and verb tense. Change ""Lets"" to ""Let's"" for contraction. Change ""that is"" to ""which is"" for relative clause. Add a period after ""cleanliness"" for sentence break. Change ""spreading the garbage"" to ""dumping garbage"" for natural phrasing. This helps you use phrasing, punctuation, and verb tenses correctly. What’s the best way to promote cleanliness?"
"This may be due to people are not aware about consequences of this bad habit- spreading the rubbish.","This may be due to people not being aware of the consequences of this bad habit - spreading the rubbish.","Good analysis! The error is phrasing, punctuation, and article. Remove ""are"" and add ""not being"" for gerund structure. Change ""about"" to ""of"" for preposition. Add ""the"" before ""consequences"" for article. Add a space after ""habit"" before the dash. This helps you use phrasing, punctuation, and articles accurately. What’s the best way to raise awareness about cleanliness?"
"But, in these days, with education, people are becoming more sensible and responsible towards the environment.","But in these days, with education, people are becoming more sensitive and responsible toward the environment.","Positive change! The error is phrasing and punctuation. Remove commas after ""But"" and ""days"" for smoother flow. Change ""sensible"" to ""sensitive"" for meaning. Change ""towards"" to ""toward"" for American English consistency (optional). This helps you use phrasing and punctuation correctly. What’s the best thing about environmental education?"
"In the same line, dwellers of my village are doing lots of work to make their area clean and hygiene.","Along the same lines, inhabitants of my village are doing a lot of work to make their area clean and hygienic.","Great initiative! The error is phrasing, punctuation, and adjective. Change ""In the same line"" to ""Along the same lines"" for idiom. Change ""dwellers"" to ""inhabitants"" for variety. Change ""lots of work"" to ""a lot of work"" for phrasing. Change ""hygiene"" to ""hygienic"" for adjective form. This helps you use phrasing, punctuation, and adjectives accurately. What’s the best way to keep a village clean?"
"They collect house hold waste in a dustbin and put off with proper standard procedure.","They collect household waste in a dustbin and dispose of it with a proper standard procedure.","Good practice! The error is phrasing and verb tense. Change ""house hold"" to ""household"" for compound word. Change ""put off with"" to ""dispose of it with"" for clarity. This helps you use phrasing and verb tenses correctly. What’s the best way to dispose of waste?"
"They collect and segregate the rubbish in separate containers.","They collect and segregate the rubbish into separate containers.","Efficient method! The error is phrasing. Change ""in"" to ""into"" for preposition accuracy with ""segregate."" This helps you use phrasing effectively. What’s the best way to segregate rubbish?"
"For example, they collect plastic waste in yellow dustbin while, liquid and solid, degradable waste in red container.","For example, they collect plastic waste in a yellow dustbin, while liquid and solid degradable waste goes in a red container.","Clear example! The error is phrasing, punctuation, and article. Add ""a"" before ""yellow dustbin"" for article. Remove comma after ""while"" and adjust clause structure. Change ""in red container"" to ""in a red container"" for article. This helps you use phrasing, punctuation, and articles accurately. What’s the best way to manage different types of waste?"
"This makes easy and convenient to identify the waste types.","This makes it easy and convenient to identify the waste types.","Helpful method! The error is phrasing. Add ""it"" after ""makes"" for subject clarity. This helps you use phrasing effectively. What’s the best thing about identifying waste types?"
"To conclude, I would like to say that nowadays people are becoming more aware and conscious towards environment through education.","To conclude, I would like to say that nowadays people are becoming more aware and environmentally-conscious through education.","Strong conclusion! The error is phrasing and punctuation. Add a comma after ""conclude"" for clause separation. Change ""conscious towards environment"" to ""environmentally-conscious"" for compound adjective. This helps you use phrasing and punctuation correctly. What’s the best way to promote environmental awareness?"
"Today in my class there was a discussion on television education.","Today in my class there was a discussion about television education.","Interesting topic! The error is phrasing. Change ""on"" to ""about"" for preposition accuracy. This helps you use phrasing effectively. What’s the best thing about television education?"
"Television is an object that help people to know the news in real time.","Television is an object that helps people to know the news in real time.","Clear explanation! The error is phrasing and verb tense. Change ""help"" to ""helps"" for subject-verb agreement. This helps you use phrasing and verb tenses accurately. What’s the best thing about television news?"
"There are advantages and disadvantages; television can also cause an dipendence, cartoons and "" stupid "" program can damage mostly young people.","There are advantages and disadvantages; television can also cause a dependence, and cartoons and 'stupid' programs can harm young people most.","Balanced view! The error is phrasing, punctuation, and spelling. Change ""an dipendence"" to ""a dependence"" for article and spelling. Add ""and"" before ""cartoons"" for list structure. Change ""program"" to ""programs"" for plural. Change ""damage mostly young people"" to ""harm young people most"" for natural phrasing. This helps you use phrasing, punctuation, and spelling correctly. What’s the best way to balance television’s advantages and disadvantages?"
"Today there are many children that have the dipendence on television, they prefer to stay at home to watch the various child tv programs, while once our parents preferred hang out with your friends.","Today, there are many children that have a dependence on television; they prefer to stay at home to watch various children's TV programs, while our parents once preferred hanging out with their friends.","Important observation! The error is phrasing, punctuation, and spelling. Add a comma after ""Today"" for sentence start. Add ""a"" before ""dependence"" for article. Change ""dipendence"" to ""dependence"" for spelling. Add a semicolon before ""they"" for clause separation. Change ""child tv programs"" to ""children's TV programs"" for possessive and abbreviation. Change ""preferred hang out"" to ""preferred hanging out"" for gerund. Change ""your"" to ""their"" for consistency. This helps you use phrasing, punctuation, and spelling accurately. What’s the best way to reduce children’s dependence on television?"
"Television can be a useful strument if it is used with caution, accordingly I recommend use less it for prevent damage to the mental level.","Television can be a useful instrument if it is used with caution. Therefore, I recommend using it less to prevent damage to the mind.","Good advice! The error is phrasing, punctuation, and verb tense. Change ""strument"" to ""instrument"" for spelling. Add a period after ""caution"" for sentence break. Change ""accordingly I recommend use less it"" to ""Therefore, I recommend using it less"" for structure and phrasing. Change ""for prevent"" to ""to prevent"" for infinitive. Change ""mental level"" to ""mind"" for simplicity. This helps you use phrasing, punctuation, and verb tenses correctly. What’s the best way to use television wisely?"
"I am concerned about pollution.","I am concerned about pollution.","Important concern! This sentence is grammatically correct. It uses proper phrasing and tense to describe a concern. What’s the best way to reduce pollution?"
"This issue has became a big problem to solve.","This issue has become a big problem to solve.","Serious issue! The error is phrasing and verb tense. Change ""has became"" to ""has become"" for correct verb form. This helps you use phrasing and verb tenses accurately. What’s the best way to solve pollution problems?"
"In order to help reduce contamination I take acction from the three "" R"".reduce, reuse and recycle as so I am more and more ecofriendly.","In order to help reduce pollution, I take action using the three 'Rs': reduce, reuse, and recycle, so I am becoming more and more eco-friendly.","Great initiative! The error is phrasing, punctuation, and verb tense. Change ""contamination"" to ""pollution"" for context. Change ""acction"" to ""action"" for spelling. Change ""from the three "" R"""" to ""using the three 'Rs'"" for phrasing and punctuation. Add a colon after ""Rs"" for list introduction. Add ""and"" before ""recycle"" for list. Change ""as so I am more and more ecofriendly"" to ""so I am becoming more and more eco-friendly"" for tense and hyphenation. This helps you use phrasing, punctuation, and verb tenses accurately. What’s the best way to practice the three Rs?"
